{
  "schema_version": "1.0",
  "metadata": {
    "title": "Feedback-Guided Retrieval in a Controlled Assistant Memory Simulator",
    "language": "en",
    "field": "AI / retrieval / memory",
    "paper_type": "empirical simulation",
    "target_venue": null
  },
  "sources": [
    {
      "source_id": "manuscript",
      "path": "E:\\GIT\\academic-paper-reviewer\\skills\\academic-paper-reviewer\\tests\\fixtures\\synthetic_memory.md",
      "text_sha256": "bc798b4a4b1f405d89f90317b0136398d789df4870e2f9ca77533013f5de8b93",
      "file_sha256": "bc798b4a4b1f405d89f90317b0136398d789df4870e2f9ca77533013f5de8b93"
    }
  ],
  "evidence": [
    {
      "evidence_id": "E1",
      "source_id": "manuscript",
      "source_hash": "bc798b4a4b1f405d89f90317b0136398d789df4870e2f9ca77533013f5de8b93",
      "start": 84,
      "end": 498,
      "text": "We study whether usage feedback improves known-query retrieval in a controlled memory simulator. Configuration D achieves 96.2% aggregate known-query accuracy on SimMem-v1. A paired comparison isolates feedback from recency scoring, and a separate sham-intervention comparison yields a small, uncertain difference. These experiments target a synthetic retrieval mechanism rather than end-to-end assistant behavior.",
      "section": "Abstract",
      "page": null,
      "line": 4,
      "location": "E:\\GIT\\academic-paper-reviewer\\skills\\academic-paper-reviewer\\tests\\fixtures\\synthetic_memory.md:line 4"
    },
    {
      "evidence_id": "E2",
      "source_id": "manuscript",
      "source_hash": "bc798b4a4b1f405d89f90317b0136398d789df4870e2f9ca77533013f5de8b93",
      "start": 518,
      "end": 706,
      "text": "Persistent memory systems must rank facts under repeated queries. We ask: does adding usage feedback to a fixed recency-based ranker improve retrieval accuracy in a controlled environment?",
      "section": "1 Introduction",
      "page": null,
      "line": 7,
      "location": "E:\\GIT\\academic-paper-reviewer\\skills\\academic-paper-reviewer\\tests\\fixtures\\synthetic_memory.md:line 7"
    },
    {
      "evidence_id": "E3",
      "source_id": "manuscript",
      "source_hash": "bc798b4a4b1f405d89f90317b0136398d789df4870e2f9ca77533013f5de8b93",
      "start": 707,
      "end": 951,
      "text": "We propose a feedback update rule and a simulator that permits paired interventions on identical generated workloads. Our contributions are an interpretable feedback intervention, a matched baseline comparison, and a diagnostic negative result.",
      "section": "1 Introduction",
      "page": null,
      "line": 8,
      "location": "E:\\GIT\\academic-paper-reviewer\\skills\\academic-paper-reviewer\\tests\\fixtures\\synthetic_memory.md:line 8"
    },
    {
      "evidence_id": "E4",
      "source_id": "manuscript",
      "source_hash": "bc798b4a4b1f405d89f90317b0136398d789df4870e2f9ca77533013f5de8b93",
      "start": 965,
      "end": 1194,
      "text": "SimMem-v1 consists of twelve independently generated scenarios, each containing 1,000 queries over 200 memory items. Queries within a scenario share memory state and are repeated measurements, not independent scenario replicates.",
      "section": "2 Method",
      "page": null,
      "line": 11,
      "location": "E:\\GIT\\academic-paper-reviewer\\skills\\academic-paper-reviewer\\tests\\fixtures\\synthetic_memory.md:line 11"
    },
    {
      "evidence_id": "E5",
      "source_id": "manuscript",
      "source_hash": "bc798b4a4b1f405d89f90317b0136398d789df4870e2f9ca77533013f5de8b93",
      "start": 1195,
      "end": 1383,
      "text": "Each item is assigned a vector sampled from an isotropic Gaussian distribution; no pretrained embedding model is used. The generator includes no linguistic texts or real user interactions.",
      "section": "2 Method",
      "page": null,
      "line": 12,
      "location": "E:\\GIT\\academic-paper-reviewer\\skills\\academic-paper-reviewer\\tests\\fixtures\\synthetic_memory.md:line 12"
    },
    {
      "evidence_id": "E6",
      "source_id": "manuscript",
      "source_hash": "bc798b4a4b1f405d89f90317b0136398d789df4870e2f9ca77533013f5de8b93",
      "start": 1384,
      "end": 1659,
      "text": "Configuration C ranks items using cosine similarity plus fixed recency weight 0.2. Configuration D adds only a usage-feedback term of weight 0.1 to C. All other ranking factors, query sequences, item vectors, and memory initializations are identical within a paired scenario.",
      "section": "2 Method",
      "page": null,
      "line": 13,
      "location": "E:\\GIT\\academic-paper-reviewer\\skills\\academic-paper-reviewer\\tests\\fixtures\\synthetic_memory.md:line 13"
    },
    {
      "evidence_id": "E7",
      "source_id": "manuscript",
      "source_hash": "bc798b4a4b1f405d89f90317b0136398d789df4870e2f9ca77533013f5de8b93",
      "start": 1660,
      "end": 1897,
      "text": "Feedback is drawn from a Bernoulli distribution with manually specified success probability 0.8 for correctly retrieved items. Feedback affects later rankings within that scenario, and state is reset between configurations and scenarios.",
      "section": "2 Method",
      "page": null,
      "line": 14,
      "location": "E:\\GIT\\academic-paper-reviewer\\skills\\academic-paper-reviewer\\tests\\fixtures\\synthetic_memory.md:line 14"
    },
    {
      "evidence_id": "E8",
      "source_id": "manuscript",
      "source_hash": "bc798b4a4b1f405d89f90317b0136398d789df4870e2f9ca77533013f5de8b93",
      "start": 1898,
      "end": 2118,
      "text": "The evaluation set is generated independently of weight selection; the weights were fixed before evaluation. The split protocol and generator rules are provided here, but no downloaded data or model training is involved.",
      "section": "2 Method",
      "page": null,
      "line": 15,
      "location": "E:\\GIT\\academic-paper-reviewer\\skills\\academic-paper-reviewer\\tests\\fixtures\\synthetic_memory.md:line 15"
    },
    {
      "evidence_id": "E9",
      "source_id": "manuscript",
      "source_hash": "bc798b4a4b1f405d89f90317b0136398d789df4870e2f9ca77533013f5de8b93",
      "start": 2119,
      "end": 2359,
      "text": "Configuration A uses cosine similarity alone. Configuration B adds a sham feedback signal with weight zero. A and B use paired scenarios and unchanged ranking factors to check whether the measurement procedure introduces a spurious benefit.",
      "section": "2 Method",
      "page": null,
      "line": 16,
      "location": "E:\\GIT\\academic-paper-reviewer\\skills\\academic-paper-reviewer\\tests\\fixtures\\synthetic_memory.md:line 16"
    },
    {
      "evidence_id": "E10",
      "source_id": "manuscript",
      "source_hash": "bc798b4a4b1f405d89f90317b0136398d789df4870e2f9ca77533013f5de8b93",
      "start": 2377,
      "end": 2664,
      "text": "Known-query accuracy is the percentage of generated queries whose top-ranked item is the designated correct item. We average the twelve per-scenario accuracies with equal weights. All configurations process the same 12,000 query instances, and runtime is measured on a single CPU worker.",
      "section": "3 Evaluation",
      "page": null,
      "line": 19,
      "location": "E:\\GIT\\academic-paper-reviewer\\skills\\academic-paper-reviewer\\tests\\fixtures\\synthetic_memory.md:line 19"
    },
    {
      "evidence_id": "E11",
      "source_id": "manuscript",
      "source_hash": "bc798b4a4b1f405d89f90317b0136398d789df4870e2f9ca77533013f5de8b93",
      "start": 2665,
      "end": 2844,
      "text": "For the D-minus-C interval, we bootstrap the 12,000 query outcomes independently 2,000 times, using a 95% percentile interval. We do not resample whole scenarios in this analysis.",
      "section": "3 Evaluation",
      "page": null,
      "line": 20,
      "location": "E:\\GIT\\academic-paper-reviewer\\skills\\academic-paper-reviewer\\tests\\fixtures\\synthetic_memory.md:line 20"
    },
    {
      "evidence_id": "E12",
      "source_id": "manuscript",
      "source_hash": "bc798b4a4b1f405d89f90317b0136398d789df4870e2f9ca77533013f5de8b93",
      "start": 2845,
      "end": 3058,
      "text": "For the B-minus-A diagnostic, the 95% interval is formed by paired resampling of the twelve scenario-level differences. The diagnostic was specified before evaluation and is reported irrespective of its direction.",
      "section": "3 Evaluation",
      "page": null,
      "line": 21,
      "location": "E:\\GIT\\academic-paper-reviewer\\skills\\academic-paper-reviewer\\tests\\fixtures\\synthetic_memory.md:line 21"
    },
    {
      "evidence_id": "E13",
      "source_id": "manuscript",
      "source_hash": "bc798b4a4b1f405d89f90317b0136398d789df4870e2f9ca77533013f5de8b93",
      "start": 3059,
      "end": 3283,
      "text": "All experiments use Python 3.11 and NumPy 1.26. Hyperparameters and the evaluation procedure are described above. This draft does not include executable code, per-scenario results, analysis scripts, or a dependency lockfile.",
      "section": "3 Evaluation",
      "page": null,
      "line": 22,
      "location": "E:\\GIT\\academic-paper-reviewer\\skills\\academic-paper-reviewer\\tests\\fixtures\\synthetic_memory.md:line 22"
    },
    {
      "evidence_id": "E16",
      "source_id": "manuscript",
      "source_hash": "bc798b4a4b1f405d89f90317b0136398d789df4870e2f9ca77533013f5de8b93",
      "start": 3460,
      "end": 3595,
      "text": "The D-minus-C aggregate difference is 24.68 percentage points, with a query-bootstrap 95% interval from 24.1 to 25.2 percentage points.",
      "section": "4 Results",
      "page": null,
      "line": 30,
      "location": "E:\\GIT\\academic-paper-reviewer\\skills\\academic-paper-reviewer\\tests\\fixtures\\synthetic_memory.md:line 30"
    },
    {
      "evidence_id": "E17",
      "source_id": "manuscript",
      "source_hash": "bc798b4a4b1f405d89f90317b0136398d789df4870e2f9ca77533013f5de8b93",
      "start": 3596,
      "end": 3717,